{
  "sessionId": "DEMO50",
  "createdAt": "2026-01-01T00:00:00Z",
  "desks": [
    {
      "id": "A1",
      "x": 0.0,
      "y": 0.0
    },
    {
      "id": "B1",
      "x": 2.0,
      "y": 0.0
    },
    {
      "id": "C1",
      "x": 4.0,
      "y": 0.0
    },
    {
      "id": "D1",
      "x": 6.0,
      "y": 0.0
    },
    {
      "id": "E1",
      "x": 8.0,
      "y": 0.0
    },
    {
      "id": "F1",
      "x": 10.0,
      "y": 0.0
    },
    {
      "id": "G1",
      "x": 12.0,
      "y": 0.0
    },
    {
      "id": "H1",
      "x": 14.0,
      "y": 0.0
    },
    {
      "id": "I1",
      "x": 16.0,
      "y": 0.0
    },
    {
      "id": "J1",
      "x": 18.0,
      "y": 0.0
    },
    {
      "id": "A2",
      "x": 0.0,
      "y": 2.0
    },
    {
      "id": "B2",
      "x": 2.0,
      "y": 2.0
    },
    {
      "id": "C2",
      "x": 4.0,
      "y": 2.0
    },
    {
      "id": "D2",
      "x": 6.0,
      "y": 2.0
    },
    {
      "id": "E2",
      "x": 8.0,
      "y": 2.0
    },
    {
      "id": "F2",
      "x": 10.0,
      "y": 2.0
    },
    {
      "id": "G2",
      "x": 12.0,
      "y": 2.0
    },
    {
      "id": "H2",
      "x": 14.0,
      "y": 2.0
    },
    {
      "id": "I2",
      "x": 16.0,
      "y": 2.0
    },
    {
      "id": "J2",
      "x": 18.0,
      "y": 2.0
    },
    {
      "id": "A3",
      "x": 0.0,
      "y": 4.0
    },
    {
      "id": "B3",
      "x": 2.0,
      "y": 4.0
    },
    {
      "id": "C3",
      "x": 4.0,
      "y": 4.0
    },
    {
      "id": "D3",
      "x": 6.0,
      "y": 4.0
    },
    {
      "id": "E3",
      "x": 8.0,
      "y": 4.0
    },
    {
      "id": "F3",
      "x": 10.0,
      "y": 4.0
    },
    {
      "id": "G3",
      "x": 12.0,
      "y": 4.0
    },
    {
      "id": "H3",
      "x": 14.0,
      "y": 4.0
    },
    {
      "id": "I3",
      "x": 16.0,
      "y": 4.0
    },
    {
      "id": "J3",
      "x": 18.0,
      "y": 4.0
    },
    {
      "id": "A4",
      "x": 0.0,
      "y": 6.0
    },
    {
      "id": "B4",
      "x": 2.0,
      "y": 6.0
    },
    {
      "id": "C4",
      "x": 4.0,
      "y": 6.0
    },
    {
      "id": "D4",
      "x": 6.0,
      "y": 6.0
    },
    {
      "id": "E4",
      "x": 8.0,
      "y": 6.0
    },
    {
      "id": "F4",
      "x": 10.0,
      "y": 6.0
    },
    {
      "id": "G4",
      "x": 12.0,
      "y": 6.0
    },
    {
      "id": "H4",
      "x": 14.0,
      "y": 6.0
    },
    {
      "id": "I4",
      "x": 16.0,
      "y": 6.0
    },
    {
      "id": "J4",
      "x": 18.0,
      "y": 6.0
    },
    {
      "id": "A5",
      "x": 0.0,
      "y": 8.0
    },
    {
      "id": "B5",
      "x": 2.0,
      "y": 8.0
    },
    {
      "id": "C5",
      "x": 4.0,
      "y": 8.0
    },
    {
      "id": "D5",
      "x": 6.0,
      "y": 8.0
    },
    {
      "id": "E5",
      "x": 8.0,
      "y": 8.0
    },
    {
      "id": "F5",
      "x": 10.0,
      "y": 8.0
    },
    {
      "id": "G5",
      "x": 12.0,
      "y": 8.0
    },
    {
      "id": "H5",
      "x": 14.0,
      "y": 8.0
    },
    {
      "id": "I5",
      "x": 16.0,
      "y": 8.0
    },
    {
      "id": "J5",
      "x": 18.0,
      "y": 8.0
    }
  ],
  "experiment1": [
    {
      "deskId": "A1",
      "taps_ms": [
        6.572945148009267,
        499.70545663735527,
        983.6986622029415,
        1498.4287270170494,
        1991.8188366904649,
        2481.014174256559,
        2987.0207050009,
        3482.3502993647057,
        3978.84874019635,
        4473.785018181519,
        4974.993304171781,
        5461.789927610756,
        5963.440240750713,
        6457.948525861107,
        6963.658210091511,
        7456.247177278176,
        7950.65170643849,
        8443.798052775244,
        8945.057742577035,
        9444.242377974022,
        9939.034377315369,
        10448.653671100838,
        10943.416915135986,
        11410.7357808097,
        11914.374934701575,
        12425.150823960763,
        12920.233437432482,
        13422.38206473297,
        13919.473456229049,
        14431.739550849165
      ]
    },
    {
      "deskId": "B1",
      "taps_ms": [
        -3.0208400570159846,
        487.2650946175145,
        947.0194674847664,
        1418.0732722517375,
        1879.5796360568036,
        2341.430007421034,
        2826.877248499237,
        3297.332565005603,
        3757.5645576266497,
        4232.840482523939,
        4708.6528681379405,
        5172.594126348848,
        5650.288901348093,
        6122.761847068241,
        6593.205594502505,
        7059.793493097122,
        7539.5167326955,
        8012.819005513047,
        8479.179378072899,
        8940.989671574818,
        9424.3116534218,
        9885.369836761356,
        10367.337563612973,
        10822.652901089225,
        11309.46585980685,
        11772.912536302472,
        12234.005974574296,
        12712.407691678813,
        13186.274627442295,
        13658.947061683015
      ]
    },
    {
      "deskId": "C1",
      "taps_ms": [
        -8.858984377321544,
        452.0655140580578,
        897.2036786555238,
        1353.290558279685,
        1807.9515073609514,
        2239.1538900455976,
        2704.848131703827,
        3163.0790403072533,
        3601.370487607285,
        4047.7330234916294,
        4510.706328570247,
        4957.184787877757,
        5412.793118109594,
        5853.333165658244,
        6294.709182944158,
        6756.152480811527,
        7203.934779500408,
        7664.172833096159,
        8109.988143102078,
        8545.86112425086,
        8999.815451264796,
        9466.915905993603,
        9915.752551635527,
        10355.661322364198,
        10811.243716714207,
        11265.285533312237,
        11715.937017364087,
        12169.668558041505,
        12615.179343285643,
        13062.837669351404
      ]
    },
    {
      "deskId": "D1",
      "taps_ms": [
        8.44594240426601,
        549.3707543764484,
        1133.6459345534226,
        1702.3967665631026,
        2258.1075626213456,
        2839.550451790488,
        3399.055283362913,
        3978.542678410063,
        4538.015971944339,
        5111.751523120006,
        5683.526634612136,
        6244.216911009552,
        6801.525293777538,
        7363.79410244836,
        7957.313313019205,
        8509.77349111065,
        9072.532897652152,
        9646.573062514792,
        10211.26530374352,
        10786.99132107816,
        11347.823197001031,
        11915.039356787558,
        12476.590310927424,
        13053.441082062744,
        13608.791192071001,
        14189.76682994503,
        14764.008803107916,
        15306.997403276278,
        15866.84264630734,
        16458.88509877646
      ]
    },
    {
      "deskId": "E1",
      "taps_ms": [
        -8.007398790975149,
        525.4124509535834,
        1075.5477855182423,
        1599.5282783515313,
        2137.623864224503,
        2674.305145386526,
        3216.76411883433,
        3744.68370027685,
        4285.567198912635,
        4817.3498871448455,
        5347.422801410779,
        5887.039577202046,
        6417.413006966648,
        6960.486341198949,
        7486.861308515465,
        8022.527100405627,
        8578.34396690643,
        9101.680815645544,
        9637.09309022821,
        10177.034614815326,
        10704.993484459594,
        11241.95007456416,
        11782.597564410638,
        12316.873718289937,
        12840.758034760524,
        13392.117166373338,
        13916.14496307767,
        14447.837828045465,
        14984.500676111988,
        15523.998130941136
      ]
    },
    {
      "deskId": "F1",
      "taps_ms": [
        -9.404287239366244,
        578.6811904164639,
        1137.6985716876538,
        1732.189214363406,
        2316.798864444565,
        2885.109609804454,
        3459.3686602660687,
        4043.656171445793,
        4624.805880218719,
        5201.914510053843,
        5789.7856235933305,
        6353.0797558167715,
        6924.067718516248,
        7505.199749070566,
        8083.02817750169,
        8661.878648210664,
        9238.169109913191,
        9817.201643206385,
        10379.843698486486,
        10977.248113895916,
        11543.413751372414,
        12116.026979228398,
        12707.914841353295,
        13290.75202341144,
        13861.558223824537,
        14436.303856415494,
        15004.957402737944,
        15612.788287159616,
        16174.25840069859,
        16735.50255764674
      ]
    },
    {
      "deskId": "G1",
      "taps_ms": [
        0.6958339885752348,
        421.20678044213713,
        868.6383022522941,
        1297.2613160486128,
        1744.3886827949498,
        2175.9203847995514,
        2580.177493489152,
        3035.8460271749536,
        3456.2172959886507,
        3911.6787694769337,
        4337.791141934073,
        4774.478168096652,
        5195.214556146833,
        5652.007625379329,
        6087.185399910673,
        6496.151274130565,
        6941.296592944611,
        7366.572282040664,
        7805.414771471004,
        8229.122864630199,
        8687.829754078746,
        9098.783783371544,
        9537.813178438331,
        9977.8383419053,
        10402.29062252719,
        10839.201238014766,
        11270.251248179315,
        11707.337310410145,
        12132.685284866138,
        12572.190350840227
      ]
    },
    {
      "deskId": "H1",
      "taps_ms": [
        -2.669808030433079,
        408.27899413664454,
        813.3061312401345,
        1229.5021147599973,
        1628.71633058369,
        2038.0341757171038,
        2441.634596296998,
        2850.566202761537,
        3252.4878536533956,
        3674.5795498444713,
        4069.114600833722,
        4480.113368286929,
        4896.779651186019,
        5304.95175539498,
        5706.355724956878,
        6101.227990978502,
        6528.571698258271,
        6935.109574128537,
        7329.559491231121,
        7754.846592114744,